name,id,tags,rarity,base price,stack size,cargo space,icon,sound id,sound id drop,plugin,plugin params,desc,order
Project Kaze Blueprint Package,tahlan_kaze_package,package_bp,0.2,100000,1000,1,graphics/icons/cargo/blueprint_hightech.png,ui_chip_pickup,ui_bp_package_drop,com.fs.starfarer.api.campaign.impl.items.MultiBlueprintItemPlugin,tahlan_kaze_bp,"Enables heavy industry to construct ship hulls related to the secretive ""Project Kaze"".",210
Kassadari Equipment Blueprint Package,tahlan_knight_package,package_bp,0.2,150000,1000,1,graphics/icons/cargo/blueprint_midline.png,ui_chip_pickup,ui_bp_package_drop,com.fs.starfarer.api.campaign.impl.items.MultiBlueprintItemPlugin,tahlan_knight_bp,Enables heavy industry to construct the arcane weapon and fighter designs of the Great Houses of Kassadar.,220
Kassadari Database Backup,tahlan_knight_all_package,package_bp,0.01,10000000,1000,1,graphics/icons/cargo/blueprint_lowtech.png,ui_chip_pickup,ui_bp_package_drop,com.fs.starfarer.api.campaign.impl.items.MultiBlueprintItemPlugin,tahlan_knights,"A long-lost backup of a Kassadari datavault, containing schematics to all the designs of the Great Houses of Kassadar.",230
Legio Infernalis Blueprint Package,tahlan_legio_package,package_bp,0.3,150000,1000,1,graphics/icons/cargo/blueprint_lowtech.png,ui_chip_pickup,ui_bp_package_drop,com.fs.starfarer.api.campaign.impl.items.MultiBlueprintItemPlugin,tahlan_legio_bp,Enables heavy industry to construct the obscure weapon and fighter designs of the Legio Infernalis.,250
Legio Infernalis Full Database,tahlan_legio_full_package,package_bp,0,150000,1000,1,graphics/icons/cargo/blueprint_lowtech.png,ui_chip_pickup,ui_bp_package_drop,com.fs.starfarer.api.campaign.impl.items.MultiBlueprintItemPlugin,tahlan_legio,A database containing all ship and weapon designs of the Legio Infernalis as provided only to its most loyal members.,260
Lifeless Project Database,tahlan_lifeless_package,package_bp,0.03,9000000,1000,1,graphics/icons/cargo/blueprint_hightech.png,ui_chip_pickup,ui_bp_package_drop,com.fs.starfarer.api.campaign.impl.items.MultiBlueprintItemPlugin,tahlan_lifeless_bp,"The remains of a hidden database, recovered from a secret data vault. It contains schematics to what is referred to as the Lifeless Fleet.",240
Mysterious Blueprint Archive,tahlan_rare_bp_package,package_bp,0.005,10000000,1000,1,graphics/icons/cargo/blueprint_hightech.png,ui_chip_pickup,ui_bp_package_drop,com.fs.starfarer.api.campaign.impl.items.MultiBlueprintItemPlugin,rare_bp,A blueprint archive of unknown origins. It appears to contain a massive collection of rare blueprints from all corners of the sector.,270